{
  "name": "hospitality-cabin",
  "version": "0.1.0",
  "schema_version": 2,
  "keywords": ["cabin", "hospitality", "bedroom", "ensuite", "deck", "pitched roof", "single story", "6x8"],
  "examples_count": 2,
  "eval_id": "skill-hospitality-cabin-v01",
  "steps": [
    {"verb": "IfcLevel", "args": {"elevation": 0, "extent": 8, "name": "Ground Floor"}},
    {"verb": "IfcSlab", "args": {"profile": [[0,0],[6,0],[6,8],[0,8]], "thickness": 0.2}},
    {"verb": "IfcWall", "args": {"length": 6, "thickness": 0.2, "height": 2.7}},
    {"verb": "IfcWall", "args": {"length": 6, "thickness": 0.2, "height": 2.7}},
    {"verb": "IfcWall", "args": {"length": 8, "thickness": 0.2, "height": 2.7}},
    {"verb": "IfcWall", "args": {"length": 8, "thickness": 0.2, "height": 2.7}},
    {"verb": "IfcSpace", "args": {"footprint": [[3,4],[6,4],[6,8],[3,8]], "height": 2.7, "name": "bedroom"}},
    {"verb": "IfcSpace", "args": {"footprint": [[0,4],[3,4],[3,8],[0,8]], "height": 2.7, "name": "ensuite"}},
    {"verb": "IfcSpace", "args": {"footprint": [[0,0],[6,0],[6,4],[0,4]], "height": 2.7, "name": "living"}},
    {"verb": "IfcSpace", "args": {"footprint": [[0,-1.5],[6,-1.5],[6,0],[0,0]], "height": 0.3, "name": "deck"}},
    {"verb": "IfcRoof", "args": {"footprint": [[0,0],[6,0],[6,8],[0,8]], "pitchDeg": 30}},
    {"verb": "IfcDoor", "args": {"width": 0.9, "height": 2.1}},
    {"verb": "IfcDoor", "args": {"width": 0.9, "height": 2.1}}
  ]
}
