{
  "name": "fire-station",
  "version": "0.1.0",
  "schema_version": 2,
  "keywords": ["fire station", "apparatus bay", "emergency services", "dormitory", "garage bay", "fire house"],
  "examples_count": 2,
  "eval_id": "skill-fire-station-v01",
  "steps": [
    {"verb": "IfcLevel", "args": {"elevation": 0, "extent": 24, "name": "Ground Floor"}},
    {"verb": "IfcSlab", "args": {"profile": [[0,0],[24,0],[24,25],[0,25]], "thickness": 0.2}},
    {"verb": "IfcWall", "args": {"length": 24, "thickness": 0.3, "height": 4.5}},
    {"verb": "IfcWall", "args": {"length": 24, "thickness": 0.3, "height": 4.5}},
    {"verb": "IfcWall", "args": {"length": 25, "thickness": 0.3, "height": 4.5}},
    {"verb": "IfcWall", "args": {"length": 25, "thickness": 0.3, "height": 4.5}},
    {"verb": "IfcSpace", "args": {"footprint": [[0,0],[8,0],[8,9],[0,9]], "height": 4.5, "name": "apparatus bay 1"}},
    {"verb": "IfcSpace", "args": {"footprint": [[8,0],[16,0],[16,9],[8,9]], "height": 4.5, "name": "apparatus bay 2"}},
    {"verb": "IfcSpace", "args": {"footprint": [[16,0],[24,0],[24,9],[16,9]], "height": 4.5, "name": "apparatus bay 3"}},
    {"verb": "IfcSpace", "args": {"footprint": [[0,9],[4,9],[4,13],[0,13]], "height": 2.8, "name": "bathroom 1"}},
    {"verb": "IfcSpace", "args": {"footprint": [[4,9],[8,9],[8,13],[4,13]], "height": 2.8, "name": "bathroom 2"}},
    {"verb": "IfcSpace", "args": {"footprint": [[8,9],[13,9],[13,14],[8,14]], "height": 2.8, "name": "kitchen"}},
    {"verb": "IfcSpace", "args": {"footprint": [[13,9],[24,9],[24,25],[13,25]], "height": 2.8, "name": "dormitory"}},
    {"verb": "IfcSpace", "args": {"footprint": [[0,13],[8,13],[8,25],[0,25]], "height": 2.8, "name": "day room"}},
    {"verb": "IfcDoor", "args": {"width": 4.0, "height": 4.2}},
    {"verb": "IfcDoor", "args": {"width": 4.0, "height": 4.2}},
    {"verb": "IfcDoor", "args": {"width": 4.0, "height": 4.2}},
    {"verb": "IfcDoor", "args": {"width": 0.9, "height": 2.1}}
  ]
}
