{
  "name": "sf-residence-2br",
  "version": "0.1.0",
  "schema_version": 2,
  "keywords": ["residence", "house", "two bedroom", "2br", "two story", "garage", "san francisco", "single family"],
  "examples_count": 2,
  "eval_id": "skill-sf-residence-2br-v01",
  "steps": [
    {"verb": "IfcLevel", "args": {"elevation": 0, "extent": 12, "name": "Ground Floor"}},
    {"verb": "IfcLevel", "args": {"elevation": 3.0, "extent": 12, "name": "Upper Floor"}},
    {"verb": "IfcSlab", "args": {"profile": [[0,0],[12,0],[12,10],[0,10]], "thickness": 0.2}},
    {"verb": "IfcSlab", "args": {"profile": [[0,0],[12,0],[12,10],[0,10]], "thickness": 0.2}},
    {"verb": "IfcWall", "args": {"length": 12, "thickness": 0.2, "height": 3.0}},
    {"verb": "IfcWall", "args": {"length": 12, "thickness": 0.2, "height": 3.0}},
    {"verb": "IfcWall", "args": {"length": 10, "thickness": 0.2, "height": 3.0}},
    {"verb": "IfcWall", "args": {"length": 10, "thickness": 0.2, "height": 3.0}},
    {"verb": "IfcWall", "args": {"length": 12, "thickness": 0.2, "height": 3.0}},
    {"verb": "IfcWall", "args": {"length": 12, "thickness": 0.2, "height": 3.0}},
    {"verb": "IfcWall", "args": {"length": 10, "thickness": 0.2, "height": 3.0}},
    {"verb": "IfcWall", "args": {"length": 10, "thickness": 0.2, "height": 3.0}},
    {"verb": "IfcSpace", "args": {"footprint": [[0,0],[6,0],[6,5],[0,5]], "height": 3.0, "name": "garage"}},
    {"verb": "IfcSpace", "args": {"footprint": [[6,0],[12,0],[12,5],[6,5]], "height": 3.0, "name": "living room"}},
    {"verb": "IfcSpace", "args": {"footprint": [[0,5],[6,5],[6,10],[0,10]], "height": 3.0, "name": "kitchen"}},
    {"verb": "IfcSpace", "args": {"footprint": [[6,5],[12,5],[12,10],[6,10]], "height": 3.0, "name": "bathroom ground"}},
    {"verb": "IfcSpace", "args": {"footprint": [[0,0],[6,0],[6,5],[0,5]], "height": 3.0, "name": "bedroom 1"}},
    {"verb": "IfcSpace", "args": {"footprint": [[6,0],[12,0],[12,5],[6,5]], "height": 3.0, "name": "bedroom 2"}},
    {"verb": "IfcSpace", "args": {"footprint": [[0,5],[12,5],[12,10],[0,10]], "height": 3.0, "name": "bathroom upper"}},
    {"verb": "IfcRoof", "args": {"footprint": [[0,0],[12,0],[12,10],[0,10]], "pitchDeg": 20}},
    {"verb": "IfcDoor", "args": {"width": 2.4, "height": 2.1}},
    {"verb": "IfcDoor", "args": {"width": 0.9, "height": 2.1}},
    {"verb": "IfcWindow", "args": {"width": 1.2, "height": 1.4}},
    {"verb": "IfcWindow", "args": {"width": 1.2, "height": 1.4}}
  ]
}
