{
  "name": "research-from-prompt",
  "version": "0.1.0",
  "schema_version": 1,
  "keywords": [
    "research",
    "corpus",
    "rag",
    "citations",
    "architecture",
    "building-codes",
    "ifc4",
    "gable-roof",
    "wall-thickness",
    "daylight"
  ],
  "examples_count": 4,
  "eval_id": "research-from-prompt-v0"
}
