{
  "name": "research-pavilion",
  "version": "0.1.0",
  "schema_version": 2,
  "keywords": ["pavilion", "research", "glazing", "timber roof", "light shelf", "civic", "8x8", "4m ceiling"],
  "examples_count": 2,
  "eval_id": "skill-research-pavilion-v01",
  "steps": [
    {"verb": "IfcLevel", "args": {"elevation": 0, "extent": 8, "name": "Ground Floor"}},
    {"verb": "IfcSlab", "args": {"profile": [[0,0],[8,0],[8,8],[0,8]], "thickness": 0.2}},
    {"verb": "IfcWall", "args": {"length": 8, "thickness": 0.2, "height": 4.0}},
    {"verb": "IfcWall", "args": {"length": 8, "thickness": 0.2, "height": 4.0}},
    {"verb": "IfcWall", "args": {"length": 8, "thickness": 0.2, "height": 4.0}},
    {"verb": "IfcWall", "args": {"length": 8, "thickness": 0.2, "height": 4.0}},
    {"verb": "IfcSpace", "args": {"footprint": [[0,0],[8,0],[8,8],[0,8]], "height": 4.0, "name": "research space"}},
    {"verb": "IfcRoof", "args": {"footprint": [[0,0],[8,0],[8,8],[0,8]], "pitchDeg": 10}},
    {"verb": "IfcWindow", "args": {"width": 6.0, "height": 3.5}},
    {"verb": "IfcWindow", "args": {"width": 6.0, "height": 3.5}},
    {"verb": "IfcDoor", "args": {"width": 0.9, "height": 2.1}}
  ]
}
